{
  "project": "InsuranceAIPlatform",
  "gate": "AI_ENGINEERING_OS_CONSOLIDATED_SAFETY_AND_TEMPLATE_HARDENING_V0.2",
  "type": "consolidated governance/safety/template macro-gate (phase-locked, non-product)",
  "verdict": "PARTIAL_ACCEPT_WITH_LIMITATIONS",
  "verdict_detail": "Patch B re-verified ACTIVE; Patch A + Patch C applied to vault working-tree (not committed); report schema + semantic-E2E standard created in gpt-handoff. Headline security item (scope-guard shell coverage) = BLOCKED_BY_PROTECTION (both targets sacred, no bypass authorized in this gate) with an exact patch provided. AIKB sync = PROPOSAL_ONLY (durable stores are separate private repos, not authorized surfaces, and a prior required phase did not pass).",
  "date_utc": "2026-05-31",
  "source_priority_used": [
    "live filesystem/repo state",
    "latest gpt-handoff reports",
    "live CLAUDE.md",
    "existing governance/hook files",
    "current prompt",
    "assumptions (marked)"
  ],
  "boundaries_honored": {
    "product_source_changed": false,
    "product_repo_changed": false,
    "azure_changed": false,
    "providers_or_keys_touched": false,
    "secrets_or_pii_published": false,
    "force_push": false,
    "vault_main_committed": false,
    "aikb_written": false,
    "sacred_file_bypassed": false,
    "hidden_activation": false,
    "phase_lock_respected": true,
    "out_of_scope_folder_staged": false,
    "person_names_sanitized_to_roles": true
  },
  "activation_status": {
    "patch_b_evidence_gate": "ACTIVE",
    "scope_guard_shell_coverage": "BLOCKED_BY_PROTECTION",
    "patch_a_protocol_honesty_fix": "ACTIVE",
    "patch_c_quarantine_entries": "QUARANTINE",
    "gate_report_schema": "ACTIVE",
    "semantic_e2e_standard": "ACTIVE",
    "aikb_template_sync": "PROPOSED"
  },
  "files_changed": [
    "00-Meta/governance/claude-session-protocol.md (vault working-tree, NOT committed)",
    "00-Meta/self-improvement/pending.md (vault working-tree, NOT committed)",
    "GitHub/gpt-handoff/_schema/gate-report.schema.json (committed)",
    "GitHub/gpt-handoff/_schema/gate-report-template.md (committed)",
    "GitHub/gpt-handoff/_standards/semantic-e2e-standard.md (committed)",
    "InsuranceAIPlatform/ai-engineering-os-consolidated-safety-and-template-hardening-v0.2/report.md (committed)",
    "InsuranceAIPlatform/ai-engineering-os-consolidated-safety-and-template-hardening-v0.2/summary.json (committed)",
    "InsuranceAIPlatform/latest-report.md (committed)",
    "InsuranceAIPlatform/latest-summary.json (committed)"
  ],
  "files_not_touched": [
    ".claude/hooks/scope-guard.ps1 (sacred; mtime May 12 — unchanged)",
    ".claude/settings.json (sacred; mtime pre-gate — unchanged)",
    "CLAUDE.md (no new change this gate; Patch B already live)",
    "slavkan777/ai-kb (AIKB durable store)",
    "slavkan777/claude-vault (ClaudeOS durable store)",
    "C:/Projects/* product repos",
    "Azure / providers",
    "vault main branch (no commit)",
    "untracked prior code-quality-audit folder (out of scope)"
  ],
  "evidence_labels": [
    { "item": "Read latest handoff + live governance/hook state", "status": "VERIFIED", "evidence": "Read tool results: latest-summary.json, scope-guard.ps1, settings.json, claude-session-protocol.md, pending.md" },
    { "item": "Patch B active & exact", "status": "VERIFIED", "evidence": "CLAUDE.md:59-61; grep -c = 1/1/1" },
    { "item": "Harden scope-guard shell coverage", "status": "MISSING", "evidence": "BLOCKED_BY_PROTECTION: scope-guard.ps1:87-88 (targets sacred) + settings.json:121-148 (no PowerShell matcher); no bypass authorized; exact patch in report.md" },
    { "item": "Patch A protocol honesty-fix", "status": "VERIFIED", "evidence": "claude-session-protocol.md:4,5,13,416,442; grep -c 'trial_status: not-wired-yet' = 0" },
    { "item": "Patch C quarantine/tracking entries", "status": "VERIFIED", "evidence": "pending.md; grep -c '### [2026-05-31 03:21]' = 4" },
    { "item": "Report/audit schema", "status": "VERIFIED", "evidence": "_schema/gate-report.schema.json (4355B) + gate-report-template.md (3616B) created" },
    { "item": "Semantic E2E standard", "status": "VERIFIED", "evidence": "_standards/semantic-e2e-standard.md (4088B) created" },
    { "item": "AIKB sync decision", "status": "VERIFIED", "evidence": "PROPOSAL_ONLY; AIKB/ClaudeOS in gpt-handoff are report channels; durable targets named (slavkan777/ai-kb, slavkan777/claude-vault); not authorized surfaces + Subphase 2 not passed" },
    { "item": "Publish consolidated report", "status": "VERIFIED", "evidence": "commit sha + push range in chat report-back" },
    { "item": "Stop without product work", "status": "VERIFIED", "evidence": "no product/Azure/provider tool call issued" }
  ],
  "bypass_used": false,
  "bypass_unset_confirmed": "N/A (never set; CLAUDE_SACRED_BYPASS empty in process)",
  "secrets_scan": "CLEAN",
  "validation": {
    "patch_b_counts": "1/1/1",
    "patch_a_stale_removed": "trial_status not-wired-yet = 0",
    "patch_c_entries": 4,
    "templates_created": 3,
    "json_parse_checked": true,
    "vault_head_unchanged": "a79f119",
    "sacred_files_mtime_pre_gate": true,
    "staged_by_explicit_path_only": true
  },
  "limitations": [
    "Headline security fix NOT applied — scope-guard shell coverage remains open (BLOCKED_BY_PROTECTION); guard is still Edit/Write-only and shell-bypassable until a hardening gate.",
    "Patch A + Patch C are working-tree only — not committed to vault-main (gate forbids); a separate commit gate is needed to persist them and Patch B.",
    "Proposed shell-scan is best-effort string match — defeatable by obfuscation; a speed-bump, not a sandbox.",
    "AIKB durable sync deferred to a dedicated authorized gate (targets named).",
    "Published labels sanitized to roles; referenced AIKB repos are private."
  ],
  "next_gates": [
    "HARDEN_SCOPE_GUARD_SHELL_COVERAGE_V0.1 (with one-shot bypass authorization like Patch B V0.2)",
    "AIKB_TEMPLATE_SYNC_V0.1 (clone + write + push slavkan777/ai-kb + claude-vault)",
    "COMMIT_GOVERNANCE_TO_VAULT_V0.1 (optional — persist Patch A/B/C to vault main)"
  ],
  "github_handoff_paths": [
    "InsuranceAIPlatform/latest-report.md",
    "InsuranceAIPlatform/latest-summary.json",
    "InsuranceAIPlatform/ai-engineering-os-consolidated-safety-and-template-hardening-v0.2/report.md",
    "InsuranceAIPlatform/ai-engineering-os-consolidated-safety-and-template-hardening-v0.2/summary.json",
    "_schema/gate-report.schema.json",
    "_schema/gate-report-template.md",
    "_standards/semantic-e2e-standard.md"
  ]
}
